Calathea loeseneri J.F. Macbr. ,sinonimo,Goeppertia loeseneri (J.F.Macbr.) Borchs. & S.Suárez,,Calathea loeseneri J.F.Macbr.,diferente
Calathea micans (L. Mathieu) Körn. ,sinonimo,Goeppertia micans (L.Mathieu) Borchs. & S.Suárez,,Calathea micans (L.Mathieu) Körn.,diferente
Ischnosiphon polyphyllus (Poepp. & Endl.) Körn. ,,Ischnosiphon polyphyllus (Poepp. & Endl.) Körn.,,Ischnosiphon polyphyllus (Poepp. & Endl.) Körn.,
Thalia multiflora Horkel ex Koern.,,Thalia multiflora Horkel ex Körn.,,Thalia multiflora Horkel ex Körn.,
Thalia geniculata L.,,Thalia geniculata L.,,Thalia geniculata L.,
Mayaca fluviatilis Aubl.,,Mayaca fluviatilis Aubl.,,Mayaca fluviatilis Aubl.,
Mayaca kunthii Seub.,,Mayaca kunthii Seub.,,Mayaca kunthii Seub.,
Mayaca longipes Mart. ex Seub. ,,Mayaca longipes Mart. ex Seub.,,Mayaca longipes Mart. ex Seub.,
Mayaca sellowiana Kunth ,,Mayaca sellowiana Kunth,sinonimo,Mayaca madida (Vell.) Stellfeld,diferente
Aciotis acuminifolia (Mart. ex DC.) Triana ,,Aciotis acuminifolia (Mart. ex DC.) Triana,,Aciotis acuminifolia (Mart. ex DC.) Triana,
Aciotis ornata (Miq.) Gleason ,,Aciotis ornata (Miq.) Gleason,,Aciotis ornata (Miq.) Gleason,
Acisanthera alsinaefolia (DC.) Triana,,Acisanthera alsinaefolia (Mart.& Schrank ex DC.) Triana,,Acisanthera alsinaefolia (DC.) Triana,diferente
Acisanthera divaricarta Cogn.,nao_encontrado,,nao_encontrado,,
Acisanthera fluitans Cogn.,sinonimo,Acisanthera limnobios (Schrank & Mart. ex DC.) Triana,,Acisanthera fluitans Cogn.,diferente
Acisanthera limnobios (DC.) Triana ,,Acisanthera limnobios (Schrank & Mart. ex DC.) Triana,,Acisanthera limnobios (DC.) Triana,diferente
Acisanthera variabilis (DC.) Triana,,Acisanthera variabilis (Naud.) Triana,,Acisanthera variabilis (DC.) Triana,diferente
Cambessedesia hilariana (Kunth) DC.,,Cambessedesia hilariana (Kunth) DC.,,Cambessedesia hilariana (Kunth) DC.,
Clidemia capitellata (Bonpl.) D. Don ,,Clidemia capitellata (Bonpl.) D.Don,,Clidemia capitellata (Bonpl.) D. Don,diferente
Clidemia hirta D.Don ,,Clidemia hirta (L.) D.Don,,Clidemia hirta (L.) D. Don,diferente
Comolia villosa (Aubl.) Triana,,Comolia villosa (Aubl.) Triana,,Comolia villosa (Aubl.) Triana,
Desmoscelis villosa (Aubl.) Naudin ,,Desmoscelis villosa (Aubl.) Naudin,,Desmoscelis villosa (Aubl.) Naudin,
Lavoisiera umbricata DC.,nao_encontrado,,nao_encontrado,,
Leandra multiplinervis (Naudin) Cogn.,,Leandra multiplinervis (Naudin) Cogn.,,Leandra multiplinervis (Naudin) Cogn.,
Maicarea radula (Bonpl.) DC.,nao_encontrado,,nao_encontrado,,
Miconia chamissois Naud.,,Miconia chamissois Naudin,,Miconia chamissois Naudin,
Microlepis oleifolia (DC.) Triana,sinonimo,Pleroma oleifolium R. Romero & Versiane,,Microlepis oleifolia (DC.) Triana,diferente
Microlicia myrtoidea Cham.,,Microlicia myrtoidea Cham.,,Microlicia myrtoidea Cham.,
Pterolepis glomerata (Rottb.) Miq. ,,Pterolepis glomerata (Rottb.) Miq.,,Pterolepis glomerata (Rottb.) Miq.,
Pterolepis repanda (DC.) Triana,,Pterolepis repanda (DC.) Triana,,Pterolepis repanda (DC.) Triana,
Rhynchanthera cordata DC.,,Rhynchanthera cordata DC.,,Rhynchanthera cordata DC.,
Rhynchanthera dichotoma (Desr.) DC. ,,Rhynchanthera dichotoma (Desr.) DC.,,Rhynchanthera dichotoma (Desr.) DC.,
Rhynchanthera grandiflora (Aubl.) DC.,,Rhynchanthera grandiflora (Aubl.) DC.,,Rhynchanthera grandiflora (Aubl.) DC.,
Rhynchanthera hispida Naudin,,Rhynchanthera hispida Naudin,,Rhynchanthera hispida Naudin,
Rhynchanthera novemnervia DC. ,,Rhynchanthera novemnervia DC.,,Rhynchanthera novemnervia DC.,
Rhynchanthera serrulata (L. C. Rich.) DC. ,,Rhynchanthera serrulata (L.C.Rich.) DC.,,Rhynchanthera serrulata (Rich.) DC.,diferente
Rhynchanthera verbenoides Cham.,,Rhynchanthera verbenoides Cham.,,Rhynchanthera verbenoides Cham.,
Tibouchina aspera Aubl.,,Tibouchina aspera Aubl.,,Tibouchina aspera Aubl.,
Tibouchina asperior (Cham.) Cogn. ,sinonimo,Pleroma asperior (Cham.) Triana,,Tibouchina asperior (Cham.) Cogn.,diferente
Tibouchina cerastifolia (Naudin) Cogn. ,,Tibouchina cerastifolia Cogn.,,Tibouchina cerastifolia Cogn.,
Tibouchina cisplatensis Cogn. ,,Tibouchina cisplatensis Cogn.,,Tibouchina cisplatensis Cogn.,
Tibouchina gracilis (Bonpl.) Cogn. ,sinonimo,Chaetogastra gracilis (Bonpl.) DC.,,Tibouchina gracilis (Bonpl.) Cogn.,diferente
Tibouchina herbacea (DC.) Cogn. ,,Tibouchina herbacea (DC.) Cogn.,,Tibouchina herbacea (DC.) Cogn.,
Tibouchina sebastianopolitana (Raddi) Cogn.,,Tibouchina sebastianopolitana Cogn.,,Tibouchina sebastianopolitana Cogn.,
Tibouchina semidecandra Cogn.,sinonimo,Pleroma semidecandrum (Schrank et Mart. ex DC.) Triana,,Tibouchina semidecandra (Mart. & Schrank ex DC.) Cogn.,diferente
Tibouchina trichopoda (DC.) Baill.,sinonimo,Pleroma trichopodum DC.,,Tibouchina trichopoda Baill.,diferente
Tibouchina urceolaris (Schr. & Mart. ex DC.),sinonimo,Pleroma urceolare (Schrank et Mart. ex DC.) Triana,,Tibouchina urceolaris Cogn.,diferente
Cissampelos andromorpha DC. ,,Cissampelos andromorpha DC.,,Cissampelos andromorpha DC.,
Cissampelos glaberrima A. St.-Hil. ,,Cissampelos glaberrima A.St.-Hil.,,Cissampelos glaberrima A.St.-Hil.,
Odontocarya arifolia Barneby ,sinonimo,Odontocarya membranacea (A.C. Sm.) R. Ortiz,Não resolvido,Odontocarya arifolia Barneby,diferente
Odontocarya tamoides (DC.) Miers ,,Odontocarya tamoides (DC.) Miers,,Odontocarya tamoides (DC.) Miers,
Nymphoides grayana (Griseb.) Kuntze ,,Nymphoides grayana (Griseb.) Kuntze,,Nymphoides grayana (Griseb.) Kuntze,
Nymphoides humboldtiana (Kunth) Kuntze ,,Nymphoides humboldtiana (Kunh) Kuntze,sinonimo,Nymphoides indica (L.) Kuntze,diferente
Nymphoides indica (L.) Kuntze,nao_encontrado,,,Nymphoides indica (L.) Kuntze,
Glinus radiatus (Ruiz & Pav.) Rohr.,,Glinus radiatus (Ruiz & Pav.) Rohrb.,,Glinus radiatus (Ruiz & Pav.) Rohrb.,
Mollugo verticillata L.,,Mollugo verticillata L.,,Mollugo verticillata L.,
Psidium acutangulum DC. ,,Psidium acutangulum DC.,,Psidium acutangulum Mart. ex DC.,diferente
Psidium cattleianum Sabine ,,Psidium cattleianum Sabine,,Psidium cattleianum Afzel. ex Sabine,diferente
Nymphaea alba  L. ,nao_encontrado,,,Nymphaea alba L.,
Nymphaea amazonum Mart. & Zucc.,,Nymphaea amazonum Mart. & Zucc.,,Nymphaea amazonum Mart. & Zucc.,
Nymphaea ampla (Salisb.) DC.,,Nymphaea ampla (Salisb.) DC.,,Nymphaea ampla (Salisb.) DC.,
Nymphaea belophylla Trickett ,,Nymphaea belophylla Trickett,,Nymphaea belophylla Trickett,
Nymphaea caerulea Savigny ,,Nymphaea caerulea Savigny,sinonimo,Nymphaea nouchali var. caerulea (Savigny) Verdc.,diferente
Nymphaea capensis Thunb.,,Nymphaea capensis Thunb.,,Nymphaea capensis Thunb.,
Nymphaea gardneriana Planch.,,Nymphaea gardneriana Planch.,,Nymphaea gardneriana Planch.,
Nymphaea jamesoniana Planch. ,,Nymphaea jamesoniana Planch.,,Nymphaea jamesoniana Planch.,
Nymphaea lasiophylla Mart. & Zucc. ,,Nymphaea lasiophylla Mart. & Zucc.,,Nymphaea lasiophylla Mart. & Zucc.,
Nymphaea lingulata Wiersema ,,Nymphaea lingulata Wiersema,,Nymphaea lingulata Wiersema,
Nymphaea lotus L.,,Nymphaea lotus L.,,Nymphaea lotus L.,
Nymphaea mexicana Zucc.,,Nymphaea mexicana Zucc.,,Nymphaea mexicana Zucc.,
Nymphaea odorata Aiton,,Nymphaea odorata Aiton,,Nymphaea odorata Aiton,
Nymphaea oxypetala Planch. ,,Nymphaea oxypetala Planch.,,Nymphaea oxypetala Planch.,
Nymphaea prolifera Wiersema ,,Nymphaea prolifera Wiersema,,Nymphaea prolifera Wiersema,
Nymphaea pulchella DC. ,,Nymphaea pulchella DC.,,Nymphaea pulchella DC.,
Nymphaea rubra Roxb. Ex. Salisb,,Nymphaea rubra Roxb. ex Andrews,,Nymphaea rubra Roxb. ex Andrews,
Nymphaea rudgeana G.Mey,,Nymphaea rudgeana G.Mey.,,Nymphaea rudgeana G.Mey.,
Victoria amazonica (Poepp.) J.E. Sowerby ,,Victoria amazonica (Poepp.) J.E.Sowerby,,Victoria amazonica (Poepp.) J.C. Sowerby,diferente
Sauvagesia erecta L. ,,Sauvagesia erecta L.,,Sauvagesia erecta L.,
Sauvagesia racemosa A. St.-Hil.,,Sauvagesia racemosa A.St.-Hil.,,Sauvagesia racemosa A.St.-Hil.,
Sauvagesia rubiginosa A.St.-Hil. ,,Sauvagesia rubiginosa A.St.-Hil.,,Sauvagesia rubiginosa A.St.-Hil.,
Sauvagesia sprengelii A.St.-Hil.,,Sauvagesia sprengelii A.St.-Hil.,,Sauvagesia sprengelii A.St.-Hil.,
Ludwigia affinis (DC.) H. Hara ,,Ludwigia affinis (DC.) H.Hara,,Ludwigia affinis (DC.) H.Hara,
Ludwigia caparosa (Cambess.) H. Hara ,,Ludwigia caparosa (Cambess.) H.Hara,,Ludwigia caparosa (Cambess.) H. Hara,diferente
Ludwigia decurrens Walter ,,Ludwigia decurrens Walter,,Ludwigia decurrens Walter,
Ludwigia densiflora (Micheli) H. Hara ,,Ludwigia densiflora (Micheli) H.Hara,,Ludwigia densiflora (Micheli) H.Hara,
Ludwigia elegans (Cambess.) Hara,,Ludwigia elegans (Cambess.) H.Hara,,Ludwigia elegans (Cambess.) H.Hara,
Ludwigia erecta (L.) H.Hara ,,Ludwigia erecta (L.) H.Hara,,Ludwigia erecta (L.) H.Hara,
Ludwigia filiformis (Micheli) Ramamoorthy,,Ludwigia filiformis (Micheli) Ramamoorthy,,Ludwigia filiformis (Micheli) Ramamoorthy,
Ludwigia grandiflora (Michx.) Greuter & Burdet,,Ludwigia grandiflora (Michx.) Greuter & Burdet,,Ludwigia grandiflora (Michx.) Greuter & Burdet,
Ludwigia helminthorrhiza (Mart.) H. Hara,,Ludwigia helminthorrhiza (Mart.) H.Hara,,Ludwigia helminthorrhiza (Mart.) H.Hara,
Ludwigia hexapetala (Hook. And Arn.) Zardini et al.,,Ludwigia hexapetala (Hook. & Arn.) Zardini et al.,,"Ludwigia hexapetala (Hook. & Arn.) Zardini, H.Y. Gu & P.H. Raven",diferente
Ludwigia hyssopifolia (G.Don) Exell,,Ludwigia hyssopifolia (G.Don) Exell,,Ludwigia hyssopifolia (G.Don) Exell,
Ludwigia inclinata (L.f.) M. Gómez,,Ludwigia inclinata (L.f.) M.Gómez,,Ludwigia inclinata (L.f.) M.Gómez,
Ludwigia irwinii T.P. Ramamoorthy ,,Ludwigia irwinii Ramamoorthy,,Ludwigia irwinii Ramamoorthy,
Ludwigia lagunae (Morong) H. Hara,,Ludwigia lagunae (Morong) H.Hara,,Ludwigia lagunae (Morong) H. Hara,diferente
Ludwigia leptocarpa (Nutt.) H.Hara,,Ludwigia leptocarpa (Nutt.) H.Hara,,Ludwigia leptocarpa (Nutt.) H.Hara,
Ludwigia linifolia Poir.,nao_encontrado,,sinonimo,Ludwigia hyssopifolia (G.Don) Exell,
Ludwigia longifolia (DC.) Hara ,,Ludwigia longifolia (DC.) H.Hara,,Ludwigia longifolia (DC.) H.Hara,
Ludwigia major (Micheli) Ramam.,,Ludwigia major (Micheli) Ramamoorthy,,Ludwigia major (Micheli) Ramamoorthy,
Ludwigia multinervia (Hook. & Arn.) Ramamoorthy,,Ludwigia multinervia (Hook. & Arn.) Ramamoorthy,,Ludwigia multinervia (Hook. & Arn.) Ramamoorthy,
Ludwigia nervosa (Poir.) H.Hara,,Ludwigia nervosa (Poir.) H.Hara,,Ludwigia nervosa (Poir.) H.Hara,
Ludwigia octovalvis (Jacq.) P.H.Raven,,Ludwigia octovalvis (Jacq.) P.H.Raven,,Ludwigia octovalvis (Jacq.) P.H.Raven,
Ludwigia peploides (Kunth) P.H.Raven ,,Ludwigia peploides (Kunth) P.H.Raven,,Ludwigia peploides (Kunth) P.H.Raven,
Ludwigia peruviana (L.) Hover,,Ludwigia peruviana (L.) H.Hara,,Ludwigia peruviana (L.) H.Hara,
Ludwigia rigida (Miq.) Sandwith ,,Ludwigia rigida (Miq.) Sandwith,,Ludwigia rigida (Miq.) Sandwith,
Ludwigia sedoides (Humb. & Bonpl.) H.Hara,nao_encontrado,,nao_encontrado,,
Ludwigia sericea (Camb.) H. Hara ,,Ludwigia sericea (Cambess.) H.Hara,,Ludwigia sericea (Cambess.) H.Hara,
Ludwigia suffruticosa (L.) H. Hara ,nao_encontrado,,sinonimo,Ludwigia octovalvis (Jacq.) P.H.Raven,
Ludwigia tomentosa (Cambess.) H.Hara ,,Ludwigia tomentosa (Cambess.) H.Hara,,Ludwigia tomentosa (Cambess.) H. Hara,diferente
Ludwigia torulosa (Arn.) H. Hara ,,Ludwigia torulosa (Arn.) H.Hara,,Ludwigia torulosa (Arn.) H.Hara,
Ludwigia uruguayensis (Camb.) H. Hara ,sinonimo,Ludwigia hexapetala (Hook. & Arn.) Zardini et al.,,Ludwigia uruguayensis (Cambess.) H.Hara,diferente
"Anacheilium alagoense (Pabst) Pabst, Moutinho ex A.V. Pinto",sinonimo,Prosthechea alagoensis (Pabst) W.E.Higgins,sinonimo,Prosthechea alagoensis (Pabst) W.E.Higgins,
Cleistes gracilis (Barb. Rodr.) Schltr.,,Cleistes gracilis (Barb.Rodr) Schltr.,sinonimo,Cleistes rodriguesii (Cogn.) Campacci,diferente
Cyrtopodium paludicolum Hoehne,,Cyrtopodium paludicolum Hoehne,nao_encontrado,,diferente
Epidendrum dendrobioides Thumb.,,Epidendrum dendrobioides Thunb.,,Epidendrum dendrobioides Thunb.,
Erythrodes pumila (Cogn.) Pabst,sinonimo,Aspidogyne pumila (Cogn.) Garay,sinonimo,Aspidogyne pumila (Cogn.) Garay,
Eulophia alta (L.) Fawc. & Rendle ,,Eulophia alta (L.) Fawc. & Rendle,,Eulophia alta (L.) Fawc. & Rendle,
Habenaria aricaensis Hoehne ,,Habenaria aricaensis Hoehne,,Habenaria aricaensis Hoehne,
Habenaria brachyphyton Schultr. ,sinonimo,Habenaria parviflora Lindl.,,Habenaria brachyphyton Schltr. ex Mansf.,diferente
Habenaria bractescens Lindl.,,Habenaria bractescens Lindl.,sinonimo,Habenaria gourlieana Gillies ex Lindl.,diferente
Habenaria graciliscarpa B. Rodr.,nao_encontrado,,nao_encontrado,,
Habenaria inconspicua Cogn.,,Habenaria inconspicua Cogn.,sinonimo,Habenaria parviflora Lindl.,diferente
Habenaria johannensis Barb. Rodr.,,Habenaria johannensis Barb.Rodr.,,Habenaria johannensis Barb.Rodr.,
Habenaria nabucoi Ruschi,,Habenaria nabucoi Ruschi,sinonimo,Habenaria melvillei Ridl.,diferente
Habenaria nuda Lindl.,,Habenaria nuda Lindl.,,Habenaria nuda Lindl.,
Habenaria parviflora Lindl. ,,Habenaria parviflora Lindl.,,Habenaria parviflora Lindl.,
Habenaria pratensis (Lindl.) Rchb. f.,,Habenaria pratensis (Salzm. ex Lindl.) Rchb.f.,,Habenaria pratensis (Lindl.) Rchb.f.,diferente
Habenaria repens Nutt. ,,Habenaria repens Nutt.,,Habenaria repens Nutt.,
Habenaria riedelii Cogn.,sinonimo,Habenaria warmingii Rchb.f.,sinonimo,Habenaria warmingii Rchb.f. & Warm.,diferente
Habenaria vaupellii Rchb. ,sinonimo,Habenaria johannensis Barb.Rodr.,sinonimo,Habenaria johannensis Barb.Rodr.,
Buchnera palustris (Aubl.) Spreng. ,,Buchnera palustris (Aubl.) Spreng.,,Buchnera palustris (Aubl.) Spreng.,
Buchnera rosea Kunth ,,Buchnera rosea Kunth,,Buchnera rosea Kunth,
Melasma melampyroides (Rich.) Pennell ,,Melasma melampyroides (Rich.) Pennell,,Melasma melampyroides (Rich.) Pennell ex Britton & P.Wilson,diferente
Vellosiella dracocephaloides (Vell.) Baill.,nao_encontrado,,,Vellosiella dracocephaloides (Vell.) Baill.,
Oxalis barrelieri L. ,,Oxalis barrelieri L.,,Oxalis barrelieri L.,
Passiflora foetida L.,,Passiflora foetida L.,,Passiflora foetida L.,
Passiflora vespertilio L. ,,Passiflora vespertilio L.,,Passiflora vespertilio L.,
Piriqueta cistoides (L.) Griseb. ,,Piriqueta cistoides (L.) Griseb.,,Piriqueta cistoides (L.) Griseb.,
"Piriqueta duarteana (A. St.-Hil., A. Juss. & Cambess.) Urb. ",,Piriqueta duarteana (Cambess.) Urb.,,"Piriqueta duarteana (A. St.-Hil., A. Juss. & Cambess.) Urb.",diferente
Piriqueta racemosa (Jacq.) Sweet,,Piriqueta racemosa (Jacq.) Sweet,,Piriqueta racemosa (Jacq.) Sweet,
Turnera scabra Millsp. ,,Turnera scabra Millsp.,,Turnera scabra Millsp.,
Sesamum indicum L.,nao_encontrado,,,Sesamum indicum L.,
Phyllanthus fluitans Benth. ex Müll. Arg. ,,Phyllanthus fluitans Benth. ex Müll.Arg.,,Phyllanthus fluitans Benth. ex Müll.Arg.,
Phyllanthus hyssopifolioloides H. B. K.,nao_encontrado,,nao_encontrado,,
Phyllanthus niruri L.,,Phyllanthus niruri L.,,Phyllanthus niruri L.,
Phyllanthus sellowianus M. Arg.,,Phyllanthus sellowianus (Klotzsch) Müll.Arg.,,Phyllanthus sellowianus (Klotzsch) Müll.Arg.,
Phyllanthus stipulatus (Raf.) G.L.Webster ,,Phyllanthus stipulatus (Raf.) G.L.Webster,,Phyllanthus stipulatus (Raf.) G.L.Webster,
Phytolacca thyrsiflora Fenzl ex J. A. Schmidt,,Phytolacca thyrsiflora Fenzl. ex J.A.Schmidt,,Phytolacca thyrsiflora Fenzl ex J.A.Schmidt,diferente
Piper caldense C.DC. ,,Piper caldense C.DC.,,Piper caldense C. DC.,diferente
Piper fuligineum Kunth,,Piper fuligineum Kunth,,Piper fuligineum Kunth,
Achetaria ocymoides (Cham. & Schltdl.) Wettst. ,,Achetaria ocymoides (Cham. & Schltdl.) Wettst.,,Achetaria ocymoides (Cham. & Schltdl.) Wettst.,
Angelonia gardneri Hook. ,sinonimo,Angelonia salicariifolia Bonpl.,,Angelonia gardneri Hook.,diferente
Bacopa aquatica Aubl.,,Bacopa aquatica Aubl.,,Bacopa aquatica Aubl.,
Bacopa arenaria Loefgr. & Edwall ,,Bacopa arenaria (Schmidt) Edwall,,Bacopa arenaria (J.A.Schmidt) Loefgr. & Edwall,diferente
Bacopa egensis (Poepp.) Pennell,,Bacopa egensis (Poepp.) Pennell,,Bacopa egensis (Poepp.) Pennell,
Bacopa lanigera Wettst.,,Bacopa lanigera (Cham. & Schltdl.) Wettst.,,Bacopa lanigera (Cham. & Schltdl.) Wettst.,
Bacopa monnieri (L.) Wettst.,,Bacopa monnieri (L.) Pennell,,Bacopa monnieri (L.) Wettst.,diferente
Bacopa rotundifolia (Michx.) Wettst.,,Bacopa rotundifolia (Michx.) Wettst.,,Bacopa rotundifolia (Michx.) Wettst.,
Bacopa salzmannii Wettst. ex Edwall,,Bacopa salzmannii (Benth.) Wettst. ex Edwall,,Bacopa salzmannii (Benth.) Edwall,diferente
Bacopa serpylloides (Cham. And Schltdl.) Angely,sinonimo,Mecardonia serpylloides (Cham. & Schltdl.) Pennell,Não resolvido,Bacopa serpylloides (Cham. & Schltdl.) Angely,diferente
Bacopa stricta (Schrad.) Edwall,,Bacopa stricta (Schrad.) Wettst. ex Edwall,,Bacopa stricta (Schrad.) Wettst. ex Edwall,
Bcopa reflexa (Benth.) Edwal,nao_encontrado,,nao_encontrado,,
Callitriche deflexa  A. Braun ex Hegelm. ,,Callitriche deflexa A.Braun ex Hegelm.,,Callitriche deflexa A.Braun ex Hegelm.,
Callitriche rimosa Fassett ,,Callitriche rimosa Fassett,,Callitriche rimosa Fassett,
Conobea aquatica Aubl. ,,Conobea aquatica Aubl.,,Conobea aquatica Aubl.,
Gratiola peruviana L. ,,Gratiola peruviana L.,,Gratiola peruviana L.,
Mecardonia procumbens (Mill.) Small ,,Mecardonia procumbens (Mill.) Small,,Mecardonia procumbens (Mill.) Small,
Mecardonia serpylloides (Cham. & Schltdl.) Pennell,,Mecardonia serpylloides (Cham. & Schltdl.) Pennell,,Mecardonia serpylloides (Cham. & Schltdl.) Pennell,
Micranthemum umbrosum (J.F. Gmel.) S.F. Blake,,Micranthemum umbrosum (Walter ex J.F.Gmel.) S.F.Blake,,Micranthemum umbrosum (J.F.Gmel.) S.F.Blake,diferente
Plantago australis Lam.,,Plantago australis Lam.,,Plantago australis Lam.,
Scoparia dulcis L.,,Scoparia dulcis L.,,Scoparia dulcis L.,
Scoparia montevidensis (Kuntze) R.E. Fr.,,Scoparia montevidensis (Spreng.) R.E.Fr.,,Scoparia montevidensis (Spreng.) R.E. Fr.,diferente
Stemodia durantifolia (L.) Sw.,,Stemodia durantifolia (L.) Sw.,,Stemodia durantifolia (L.) Sw.,
Stemodia maritima L. ,,Stemodia maritima L.,,Stemodia maritima L.,
Stemodia pratensis (Aubl.) C.C. Cowan,nao_encontrato,,,Stemodia pratensis (Aubl.) C.P.Cowan,
Limonium brasiliense (Boiss.) O. Kze.,,Limonium brasiliense (Boiss.) Kuntze,,Limonium brasiliense (Boiss.) Kuntze,
Acroceras zizanioides (Kunth) Dandy,,Acroceras zizanioides (Kunth) Dandy,,Acroceras zizanioides (Kunth) Dandy,
Agrostis palustris Huds.,nao_encontrado,,sinonimo,Agrostis stolonifera L.,
Andropogon bicornis L.,,Andropogon bicornis L.,,Andropogon bicornis L.,
Andropogon leucostachyus Kunth,,Andropogon leucostachyus Kunth,,Andropogon leucostachyus Kunth,
Andropogon selloanus (Hack.) Hack. ,,Andropogon selloanus (Hack.) Hack.,,Andropogon selloanus (Hack.) Hack.,
Andropogon virgatus Desv.,,Andropogon virgatus Desv.,,Andropogon virgatus Desv. ex Ham.,diferente
Anthephora hermaphrodita (L.) Kuntze,,Anthephora hermaphrodita (L.) Kuntze,,Anthephora hermaphrodita (L.) Kuntze,
Axonopus brasiliensis (Spreng.) Kuhlm.,,Axonopus brasiliensis (Spreng.) Kuhlm.,,Axonopus brasiliensis (Spreng.) Kuhlm.,
Axonopus leptostachyus (Flüggé) Hitchc. ,,Axonopus leptostachyus (Flüggé) Hitchc.,,Axonopus leptostachyus (Flüggé) Hitchc.,
Axonopus purpusii (Mez) Chase ,,Axonopus purpusii (Mez) Chase,,Axonopus purpusii (Mez) Chase,
Bambusa trinii Nees,sinonimo,Guadua trinii (Nees) Nees ex Rupr.,sinonimo,Guadua trinii (Nees) Rupr.,diferente
Brachiaria brizantha (Hochst. Ex A. Rich.) Stapf,sinonimo,Urochloa brizantha (Hochst. ex A. Rich.) R.D.Webster,,Brachiaria brizantha (A.Rich.) Stapf,diferente
Brachiaria decumbens (Stapf) R.D. Webster,sinonimo,Urochloa decumbens (Stapf) R.D.Webster,,Brachiaria decumbens Stapf,diferente
Brachiaria mutica (Forssk.) Stapf ,sinonimo,Urochloa mutica (Forssk.) T.Q.Nguyen,,Brachiaria mutica (Forssk.) Stapf,diferente
Brachiaria plantaginea (Link) Hitchc. ,sinonimo,Urochloa plantaginea (Link) R.D.Webster,,Brachiaria plantaginea (Link) Hitchc.,diferente
Cenchrus echinatus L. ,,Cenchrus echinatus L.,,Cenchrus echinatus L.,
Cenchrus purpureus (Schumach.) Morrone ,,Cenchrus purpureus (Schumach.) Morrone,Não resolvido,Cenchrus purpureus (Schumach.) Morrone,
Chloris barbata Sw. ,,Chloris barbata Sw.,,Chloris barbata Sw.,
Chloris exilis Renvoize,,Chloris exilis Renvoize,,Chloris exilis Renvoize,
Coix lacryma-jobi L. ,,Coix lacryma-jobi L.,,Coix lacryma-jobi L.,
Cynodon dactylon (L.) Pers. ,,Cynodon dactylon (L.) Pers.,,Cynodon dactylon (L.) Pers.,
Dactyloctenium aegyptium (L.) Willd ,,Dactyloctenium aegyptium (L.) Willd.,,Dactyloctenium aegyptium (L.) Willd.,
Digitaria ciliaris (Retz.) Koeler ,,Digitaria ciliaris (Retz.) Koeler,,Digitaria ciliaris (Retz.) Koeler,
Digitaria horizontalis Willd. ,,Digitaria horizontalis Willd.,,Digitaria horizontalis Willd.,
Digitaria violascens Link ,,Digitaria violascens Link,,Digitaria violascens Link,
Dinebra scabra (Nees) P.M. Peterson & N. Snow ,,Dinebra scabra (Nees) P.M. Peterson & N. Snow,nao_encontrado,,diferente
Echinochloa crusgalli (L.) P.Beauv.,,Echinochloa crusgalli (L.) P.Beauv.,sinonimo,Echinochloa crus-galli (L.) P.Beauv.,diferente
Echinochloa crus-pavonis (Kunth) Schult.,,Echinochloa crus-pavonis (Kunth) Schult.,,Echinochloa crus-pavonis (Kunth) Schult.,
Echinochloa polystachya (Kunth) Hitchc.,,Echinochloa polystachya (Kunth) Hitchc.,,Echinochloa polystachya (Kunth) Hitchc.,
Echinochloa colona (L.) Link,,Echinochloa colona (L.) Link,,Echinochloa colona (L.) Link,
Eleusine indica (L.) Gaertn. ,,Eleusine indica (L.) Gaertn.,,Eleusine indica (L.) Gaertn.,
Eragrostis acutiflora (Kunth) Nees ,,Eragrostis acutiflora (Kunth) Nees,,Eragrostis acutiflora (Kunth) Nees,
Eragrostis bahiensis (Schrad. ex Schult.) Schult.,,Eragrostis bahiensis Schrad. ex Schult.,,Eragrostis bahiensis Roem. & Schult.,diferente
Eragrostis ciliaris (L.) R.Br.,,Eragrostis ciliaris (L.) R.Br.,,Eragrostis ciliaris (L.) R.Br.,
"Eragrostis hypnoides (Lam.) Britton, Sterns & Poggenb. ",,"Eragrostis hypnoides (Lam.) Britton, Sterns & Poggenb.",,"Eragrostis hypnoides (Lam.) Britton, Stern & Poggenb.",diferente
Eragrostis japonica (Thunb.) Trin. ,,Eragrostis japonica (Thunb.) Trin.,,Eragrostis japonica (Thunb.) Trin.,
Eragrostis pilosa (L.) P. Beauv.,,Eragrostis pilosa (L.) P.Beauv.,,Eragrostis pilosa (L.) P.Beauv.,
Eragrostis tenella (L.) P. Beauv. ex Roem. & Schult. ,,Eragrostis tenella (L.) P.Beauv. ex Roem. & Schult.,sinonimo,Eragrostis amabilis (L.) Wight & Arn.,diferente
Eriochloa distachya Kunth ,,Eriochloa distachya Kunth,,Eriochloa distachya Kunth,
Eriochloa punctata (L.) Desv. ,,Eriochloa punctata (L.) Desv. ex Ham.,,Eriochloa punctata (L.) Ham.,diferente
Eriochrysis cayennensis P.Beauv.,,Eriochrysis cayennensis P. Beauv.,,Eriochrysis cayennensis P.Beauv.,diferente
Gynerium sagittatum (Aubl.) P. Beauv. ,,Gynerium sagittatum (Aubl.) P.Beauv.,,Gynerium sagittatum (Aubl.) P.Beauv.,
Heleochloa schoenoides (L.) Host,nao_encontrado,,sinonimo,Crypsis schoenoides (L.) Lam.,
Homolepis aturensis (Kunth) Chase ,,Homolepis aturensis (Kunth) Chase,,Homolepis aturensis (Kunth) Chase,
Homolepis isocalycia (G. Mey.) Chase,,Homolepis isocalycia (G.Mey.) Chase,nao_encontrado,,diferente
Hymenachne donacifolia (Raddi) Chase ,,Hymenachne donacifolia (Raddi) Chase,,Hymenachne donacifolia (Raddi) Chase,
Hymenachne amplexicaulis (Rudge) Nees,,Hymenachne amplexicaulis (Rudge) Nees,,Hymenachne amplexicaulis (Rudge) Nees,
Hypoginum virgatum (Desv) Dandy ,nao_encontrado,,nao_encontrado,,
Imperata brasiliensis Trin. ,,Imperata brasiliensis Trin.,,Imperata brasiliensis Trin.,
Imperata tenuis Hack.,,Imperata tenuis Hack.,,Imperata tenuis Hack.,
Isachne polygonoides (Lam.) Döll ,,Isachne polygonoides (Lam.) Döll,,Isachne polygonoides (Lam.) Döll,
Ischaemum guianense Kunth ex Hack. ,,Ischaemum guianense Kunth ex Hack.,,Ischaemum guianense Hack.,diferente
Ischaemum minus J.Presl ,,Ischaemum minus J.Presl,,Ischaemum minus J.Presl,
Lasiacis procerrima (Hack.) Hitchc. ,,Lasiacis procerrima (Hack.) Hitchc.,,Lasiacis procerrima (Hack.) Hitchc. ex Chase,diferente
Leersia hexandra Sw.,,Leersia hexandra Sw.,,Leersia hexandra Sw.,
Leptochloa fascicularis (Lam.) A. Gray ,nao_encontrado,,sinonimo,Leptochloa fusca subsp. fascicularis (Lam.) N.Snow,
Leptochloa virgata (L.) P.Beauv.,,Leptochloa virgata (L.) P.Beauv.,,Leptochloa virgata (L.) P.Beauv.,
Leptocoryphium lanatum (HBK) Nees,sinonimo,Anthaenantia lanata (Kunth) Benth.,,Leptocoryphium lanatum (Kunth) Nees,diferente
Luziola bahiensis (Steud.) Hitchc.,,Luziola bahiensis (Steud.) Hitchc.,,Luziola bahiensis (Steud.) Hitchc.,
Luziola brasiliana Moric.,sinonimo,Luziola peruviana Juss. ex J.F.Gmel.,,Luziola brasiliana Moric.,diferente
Luziola fragilis Swallen,,Luziola fragilis Swallen,,Luziola fragilis Swallen,
Luziola peruviana Juss. ex J.F. Gurel ,,Luziola peruviana Juss. ex J.F.Gmel.,,Luziola peruviana J.F.Gmel.,diferente
Luziola spruceana Benth. ex Döll ,,Luziola spruceana Benth. ex Döll,,Luziola spruceana Benth. ex Döll,
Luziola subintegra Swallen ,,Luziola subintegra Swallen,,Luziola subintegra Swallen,
Megathyrsus maximus (Jacq.) B.K.Simon & S.W.L.Jacobs,,Megathyrsus maximus (Jacq.) B.K.Simon & S.W.L.Jacobs,sinonimo,Panicum maximum Jacq.,diferente
Mesosetum loliiforme (Hochst. ex Steud.) Chase ,,Mesosetum loliiforme (Hochst.) Chase,,Mesosetum loliiforme (Steud.) Hitchc.,diferente
Olyra ecaudata Döll ,,Olyra ecaudata Döll,,Olyra ecaudata Döll,
Olyra longifolia Kunth ,,Olyra longifolia Kunth,,Olyra longifolia Kunth,
Oryza glumaepatula Steud. ,,Oryza glumaepatula Steud.,nao_encontrado,,diferente
Oryza grandiglumis (Döll) Prod. ,,Oryza grandiglumis (Döll) Prod.,,Oryza grandiglumis (Döll) Prodoehl,diferente
Oryza latifolia Desv. ,,Oryza latifolia Desv.,,Oryza latifolia Desv.,
Oryza sativa L.,,Oryza sativa L.,,Oryza sativa L.,
